{
  "cds_meta": {
    "school_name": "Yale University",
    "ipeds_id": "130794",
    "cds_year": "2025-2026",
    "confidence": "high",
    "source_filename": "yale_cds_2025-26.pdf",
    "mailing_address": "P.O. Box 208234",
    "city": "New Haven",
    "state": "CT",
    "zip": "06520",
    "country": "United States",
    "website": "http://www.yale.edu",
    "missing_sections": [
      "C5",
      "C11",
      "C12"
    ],
    "location": "New Haven, CT",
    "ranking": "#5 National Ranking",
    "admission_rate_display": "5%",
    "logo_url": "https://placehold.co/130x130/5B2BE0/ffffff?text=Y",
    "logo_mini_url": "https://placehold.co/80x80/5B2BE0/ffffff?text=Y",
    "category": "reach"
  },
  "cds_admissions": {
    "class_size": {
      "applicants_total": 50264,
      "admitted_total": 2387,
      "enrolled_total": 1633,
      "acceptance_rate": 0.0475,
      "yield_rate": 0.6841
    },
    "early_programs": {
      "early_decision": {
        "offered": false
      },
      "early_action": {
        "offered": true,
        "restrictive": true,
        "deadline": "11/1",
        "notification_date": "12/15"
      }
    },
    "factors": {
      "rigor_of_secondary_record": "very_important",
      "class_rank": "considered",
      "academic_gpa": "very_important",
      "standardized_test_scores": "very_important",
      "application_essay": "very_important",
      "recommendation": "very_important",
      "interview": "considered",
      "extracurricular_activities": "very_important",
      "talent_ability": "very_important",
      "character_personal_qualities": "very_important",
      "first_generation": "considered",
      "alumni_relation": "considered",
      "geographical_residence": "considered",
      "state_residency": "not_considered",
      "religious_affiliation": "not_considered",
      "volunteer_work": "considered",
      "work_experience": "considered",
      "level_of_applicant_interest": "not_considered"
    },
    "test_scores": {
      "test_policy": "required",
      "sat_composite_25th": 1470,
      "sat_composite_75th": 1560,
      "sat_erw_25th": 730,
      "sat_erw_75th": 780,
      "sat_math_25th": 740,
      "sat_math_75th": 790,
      "act_composite_25th": 33,
      "act_composite_75th": 35,
      "pct_submitting_sat": 71,
      "pct_submitting_act": 27
    },
    "gpa_distribution": {
      "avg_gpa": null,
      "gpa_weighted": null,
      "gpa_4_0_and_above": null,
      "gpa_3_75_to_3_99": null,
      "gpa_3_50_to_3_74": null,
      "gpa_3_25_to_3_49": null,
      "gpa_3_0_to_3_24": null
    }
  },
  "cds_academics": {
    "student_faculty_ratio": 9,
    "institution_type": "private_nonprofit",
    "setting": "urban",
    "undergrad_enrollment": 6667,
    "pct_freshmen_on_campus": 100
  },
  "cds_financials": {
    "expenses": {
      "tuition_outofstate": 72500,
      "tuition_instate": null,
      "room_and_board": 21600,
      "total_coa_outofstate": 95100,
      "total_coa_instate": null,
      "required_fees": 0,
      "books_supplies": 1000,
      "transportation": 1100,
      "other_expenses": 2700
    },
    "financial_aid": {
      "pct_need_fully_met": 100.0,
      "avg_need_based_aid_package": 74353,
      "avg_need_based_scholarship": 73273,
      "avg_need_based_loan": 3114,
      "pct_freshmen_with_need": 54.2,
      "aid_policy_note": null
    }
  },
  "cds_outcomes": {
    "retention_rate_fulltime": 99.4,
    "grad_rate_6yr": 0.957,
    "grad_rate_4yr": 0.575
  }
}