{
  "cds_meta": {
    "school_name": "University of Michigan",
    "ipeds_id": "170976",
    "cds_year": "2025-2026",
    "confidence": "high",
    "source_filename": "University_of_Michigan_Ann_Arbor_cds_2025-26.pdf",
    "mailing_address": "500 S. State Street",
    "city": "Ann Arbor",
    "state": "MI",
    "zip": "48109",
    "country": "United States",
    "website": "umich.edu",
    "missing_sections": [],
    "location": "Ann Arbor, MI",
    "ranking": "#21 National Ranking",
    "admission_rate_display": "16%",
    "logo_url": "https://placehold.co/130x130/5B2BE0/ffffff?text=U",
    "logo_mini_url": "https://placehold.co/80x80/5B2BE0/ffffff?text=U",
    "category": "reach"
  },
  "cds_admissions": {
    "class_size": {
      "applicants_total": 109112,
      "admitted_total": 17915,
      "enrolled_total": 8178,
      "acceptance_rate": 0.1642,
      "yield_rate": 0.4565
    },
    "early_programs": {
      "early_decision": {
        "offered": false
      },
      "early_action": {
        "offered": true,
        "restrictive": false,
        "deadline": "11/1",
        "notification_date": "1/31"
      }
    },
    "factors": {
      "rigor_of_secondary_record": "very_important",
      "academic_gpa": "very_important",
      "application_essay": "important",
      "recommendation": "important",
      "extracurricular_activities": "considered",
      "character_personal_qualities": "important",
      "talent_ability": "considered",
      "interview": "not_considered",
      "first_generation": "important",
      "state_residency": "considered",
      "geographical_residence": "considered",
      "alumni_relation": "not_considered",
      "standardized_test_scores": "important",
      "class_rank": "not_considered",
      "religious_affiliation": "not_considered",
      "level_of_applicant_interest": "considered",
      "work_experience": "considered",
      "volunteer_work": "considered"
    },
    "test_scores": {
      "test_policy": "recommended",
      "sat_composite_25th": 1370,
      "sat_composite_75th": 1530,
      "act_composite_25th": 32,
      "act_composite_75th": 34,
      "sat_erw_25th": 690,
      "sat_erw_75th": 750,
      "sat_math_25th": 680,
      "sat_math_75th": 780,
      "pct_submitting_sat": 55,
      "pct_submitting_act": 18
    },
    "gpa_distribution": {
      "avg_gpa": 3.9,
      "gpa_weighted": false,
      "gpa_4_0_and_above": 38.8,
      "gpa_3_75_to_3_99": 55.1,
      "gpa_3_50_to_3_74": 4.8,
      "gpa_3_25_to_3_49": 0.7,
      "gpa_3_0_to_3_24": 0.4
    }
  },
  "cds_academics": {
    "student_faculty_ratio": 15,
    "institution_type": "public",
    "setting": "urban",
    "undergrad_enrollment": 35358,
    "pct_freshmen_on_campus": 96
  },
  "cds_financials": {
    "expenses": {
      "tuition_outofstate": 63480,
      "tuition_instate": 17864,
      "room_and_board": 16246,
      "total_coa_outofstate": 84164,
      "total_coa_instate": 38548,
      "required_fees": 482,
      "books_supplies": 1184,
      "transportation": 400,
      "other_expenses": 2372
    },
    "financial_aid": {
      "pct_need_fully_met": 68.2,
      "avg_need_based_aid_package": 38078,
      "avg_need_based_scholarship": 30307,
      "avg_need_based_loan": 3640,
      "pct_freshmen_with_need": 37.2,
      "aid_policy_note": "The University of Michigan is committed to meeting the full demonstrated need of resident (Michigan) students, and provides some aid to out-of-state students. Applicants who were permanent legal residents of Michigan when undertaking active military duty, missionary work, Peace Corps, or similar service are presumed to retain their eligibility."
    }
  },
  "cds_outcomes": {
    "retention_rate_fulltime": 97,
    "grad_rate_6yr": 93.2,
    "grad_rate_5yr": 88.0,
    "grad_rate_4yr": 82.3
  }
}