{
  "cds_meta": {
    "school_name": "Princeton University",
    "ipeds_id": "186131",
    "cds_year": "2025-2026",
    "confidence": "high",
    "source_filename": "Princeton_University__CDS_2025_2026.pdf",
    "mailing_address": "PO Box 430",
    "city": "Princeton",
    "state": "NJ",
    "zip": "08544",
    "country": "United States",
    "website": "www.princeton.edu",
    "missing_sections": [],
    "location": "Princeton, NJ",
    "ranking": "#1 National Ranking",
    "admission_rate_display": "4%",
    "logo_url": "https://placehold.co/130x130/5B2BE0/ffffff?text=P",
    "logo_mini_url": "https://placehold.co/80x80/5B2BE0/ffffff?text=P",
    "category": "reach"
  },
  "cds_admissions": {
    "class_size": {
      "applicants_total": 42303,
      "admitted_total": 1868,
      "enrolled_total": 1408,
      "acceptance_rate": 0.0442,
      "yield_rate": 0.7537
    },
    "early_programs": {
      "early_decision": {
        "offered": false
      },
      "early_action": {
        "offered": true,
        "restrictive": true,
        "deadline": "11/1",
        "notification_date": "Mid-December"
      }
    },
    "factors": {
      "rigor_of_secondary_record": "very_important",
      "academic_gpa": "very_important",
      "application_essay": "very_important",
      "recommendation": "very_important",
      "extracurricular_activities": "very_important",
      "character_personal_qualities": "very_important",
      "talent_ability": "important",
      "interview": "considered",
      "first_generation": "considered",
      "state_residency": "not_considered",
      "geographical_residence": "considered",
      "alumni_relation": "considered",
      "standardized_test_scores": "considered",
      "class_rank": "considered",
      "religious_affiliation": "not_considered",
      "level_of_applicant_interest": "not_considered",
      "work_experience": "considered",
      "volunteer_work": "considered"
    },
    "test_scores": {
      "test_policy": "required",
      "sat_composite_25th": 1490,
      "sat_composite_75th": 1560,
      "act_composite_25th": 34,
      "act_composite_75th": 35,
      "sat_erw_25th": 740,
      "sat_erw_75th": 780,
      "sat_math_25th": 760,
      "sat_math_75th": 800,
      "pct_submitting_sat": 60,
      "pct_submitting_act": 20
    },
    "gpa_distribution": {
      "avg_gpa": 3.96,
      "gpa_weighted": true,
      "gpa_4_0_and_above": 72.0,
      "gpa_3_75_to_3_99": 24.0,
      "gpa_3_50_to_3_74": 3.0,
      "gpa_3_25_to_3_49": 1.0,
      "gpa_3_0_to_3_24": 0.0
    }
  },
  "cds_academics": {
    "student_faculty_ratio": 8,
    "institution_type": "private_nonprofit",
    "setting": "suburban",
    "undergrad_enrollment": 5916,
    "pct_freshmen_on_campus": 100
  },
  "cds_financials": {
    "expenses": {
      "tuition_outofstate": null,
      "tuition_instate": null,
      "room_and_board": null,
      "total_coa_outofstate": null,
      "total_coa_instate": null,
      "required_fees": null,
      "books_supplies": null,
      "transportation": null,
      "other_expenses": null
    },
    "financial_aid": {
      "pct_need_fully_met": 100.0,
      "avg_need_based_aid_package": 79320,
      "avg_need_based_scholarship": 79320,
      "avg_need_based_loan": 2793,
      "pct_freshmen_with_need": 70.6,
      "aid_policy_note": null
    }
  },
  "cds_outcomes": {
    "retention_rate_fulltime": 99,
    "grad_rate_6yr": 0.974,
    "grad_rate_4yr": 0.728
  }
}